type,title,director,country,release_year,rating,duration,listed_in
TV Show,Manifest,,United States,2021,TV-14,3 Seasons,"TV Dramas, TV Mysteries, TV Sci-Fi & Fantasy"
Movie,Maniyarayile Ashokan,Shamzu Zayba,India,2020,TV-14,110 min,"Comedies, International Movies, Romantic Movies"
Movie,Manje Bistre,Baljit Singh Deo,India,2017,TV-14,136 min,"Comedies, Dramas, International Movies"
Movie,MANK,David Fincher,United States,2020,R,133 min,"Dramas, Independent Movies"
Movie,Manmadhudu 2,Rahul Ravindran,India,2019,TV-MA,152 min,"Comedies, Dramas, International Movies"
Movie,Mann,Indra Kumar,India,1999,TV-14,173 min,"Dramas, International Movies, Romantic Movies"
Movie,Manolo: The Boy Who Made Shoes for Lizards,Michael Roberts,United Kingdom,2017,TV-MA,89 min,"Documentaries, International Movies"
Movie,Manorama Six Feet Under,Navdeep Singh,India,2007,TV-14,129 min,"Dramas, International Movies, Thrillers"
Movie,Manoranjan,Shammi Kapoor,India,1974,TV-14,162 min,"Comedies, International Movies, Music & Musicals"
Movie,Mansfield Park,Patricia Rozema,United Kingdom,1999,PG-13,112 min,"Comedies, Dramas, International Movies"
Movie,Manson Family Vacation,J. Davis,United States,2015,TV-MA,85 min,"Comedies, Dramas, Independent Movies"
Movie,Manto,Nandita Das,India,2018,TV-MA,114 min,"Dramas, Independent Movies, International Movies"
Movie,Mantostaan,Rahat Kazmi,India,2017,TV-MA,75 min,"Dramas, Independent Movies, International Movies"
Movie,Mantra,Nicholas Kharkongor,India,2017,TV-14,89 min,"Dramas, Independent Movies, International Movies"
Movie,Manu,Phanindra Narsetti,India,2018,TV-14,177 min,"Dramas, Independent Movies, International Movies"
Movie,Manusangada,Amshan Kumar,India,2017,TV-14,93 min,"Dramas, Independent Movies, International Movies"
Movie,Maps to the Stars,David Cronenberg,"Canada, Germany, France, United States",2014,R,112 min,"Comedies, Dramas"
TV Show,Mar de Plástico,,Spain,2017,TV-MA,2 Seasons,"Crime TV Shows, International TV Shows, Spanish-Language TV Shows"
Movie,Mara,Clive Tonge,United Kingdom,2017,TV-MA,99 min,"Horror Movies, Thrillers"
TV Show,Maradona in Mexico,,"Argentina, United States, Mexico",2020,TV-MA,1 Season,"Docuseries, Spanish-Language TV Shows"
Movie,Marauders,Steven C. Miller,"Canada, United States",2016,R,107 min,Action & Adventure
Movie,Marc Maron: End Times Fun,Lynn Shelton,United States,2020,TV-MA,71 min,Stand-Up Comedy
Movie,Marc Maron: Thinky Pain,Lance Bangs,United States,2013,TV-MA,95 min,Stand-Up Comedy
Movie,Marc Maron: Too Real,Lynn Shelton,United States,2017,TV-MA,70 min,Stand-Up Comedy
TV Show,Marcella,,United Kingdom,2019,TV-MA,3 Seasons,"British TV Shows, Crime TV Shows, International TV Shows"
TV Show,March Comes in Like a Lion,,Japan,2017,TV-14,2 Seasons,"Anime Series, International TV Shows, Teen TV Shows"
TV Show,Marching Orders,,United States,2018,TV-14,1 Season,Docuseries
Movie,Marco Luque: Tamo Junto,Caio Cobra,Brazil,2017,TV-MA,73 min,Stand-Up Comedy
TV Show,Marco Polo,,United States,2016,TV-MA,2 Seasons,"TV Action & Adventure, TV Dramas"
Movie,Marco Polo: One Hundred Eyes,Alik Sakharov,United States,2015,TV-MA,29 min,Movies
Movie,Maria,Pedring A. Lopez,Philippines,2019,TV-MA,90 min,"Action & Adventure, International Movies"
Movie,Maria Bamford: Old Baby,Jessica Yu,United States,2017,TV-MA,64 min,Stand-Up Comedy
Movie,Maria Bamford: The Special Special Special,Jordan Brady,United States,2012,TV-MA,50 min,Stand-Up Comedy
Movie,Mariah Carey's Merriest Christmas,James Yukich,United States,2015,TV-G,38 min,"Children & Family Movies, Music & Musicals"
TV Show,Marianne,,France,2019,TV-MA,1 Season,"International TV Shows, TV Dramas, TV Horror"
Movie,Mariposa,Fajar Bustomi,Indonesia,2020,TV-14,116 min,"Comedies, International Movies, Romantic Movies"
Movie,"Mariusz Kałamaga, Karol Kopiec, Wiolka Walaszczyk Hilarious Trio",,,2016,TV-MA,69 min,Stand-Up Comedy
Movie,Mark Gatiss: A Study in Sherlock,Nathan Landeg,,2016,TV-14,29 min,Movies
Movie,Marked,Nadine Ibrahim,Nigeria,2021,TV-PG,21 min,"Documentaries, International Movies"
TV Show,Marlon,,United States,2018,TV-14,2 Seasons,TV Comedies
Movie,Marlon Wayans: Woke-ish,Marcus Raboy,United States,2018,TV-MA,67 min,Stand-Up Comedy
TV Show,Maron,,United States,2016,TV-MA,4 Seasons,TV Comedies
Movie,Maroon,Pulkit,India,2016,TV-MA,94 min,"Dramas, Independent Movies, International Movies"
TV Show,Marriage or Mortgage,,,2021,TV-G,1 Season,"Reality TV, Romantic TV Shows"
Movie,Marriage Palace,Sunil Thakur,India,2018,TV-14,135 min,"Comedies, International Movies"
Movie,Marriage Story,Noah Baumbach,"United Kingdom, United States",2019,R,137 min,Dramas
TV Show,Married at First Sight,,United States,2019,TV-14,1 Season,"Reality TV, Romantic TV Shows"
TV Show,Mars,Everardo Gout,United States,2018,TV-PG,2 Seasons,"Docuseries, Science & Nature TV, TV Dramas"
Movie,Mars Attacks!,Tim Burton,United States,1996,PG-13,106 min,"Comedies, Cult Movies, Sci-Fi & Fantasy"
TV Show,Marseille,,France,2018,TV-MA,2 Seasons,"International TV Shows, TV Dramas, TV Thrillers"
Movie,Marshall,Reginald Hudlin,"United States, China, Hong Kong",2017,PG-13,118 min,Dramas
Movie,Martial Arts of Shaolin,Chia-Liang Liu,"Hong Kong, China",1986,R,90 min,"Action & Adventure, International Movies"
Movie,Martin Lawrence Live: Runteldat,David Raynr,United States,2002,R,104 min,Stand-Up Comedy
Movie,Martin Luther: The Idea that Changed the World,David Batty,United States,2017,TV-PG,55 min,"Documentaries, Faith & Spirituality"
Movie,"Martin Matte: La vie, la mort...eh la la..!",Jean-François Blais,Canada,2019,TV-14,62 min,Stand-Up Comedy
Movie,Martyrs of Marriage,Deepika Narayan Bhardwaj,India,2016,TV-14,83 min,"Documentaries, International Movies"
Movie,Marvel & ESPN Films Present: 1 of 1: Genesis,Eric Drath,,2014,TV-PG,77 min,"Documentaries, Sports Movies"
TV Show,Marvel Anime: Wolverine,,"United States, Japan",2011,TV-14,1 Season,"Anime Series, International TV Shows"
TV Show,Marvel Anime: X-Men,,Japan,2011,TV-14,1 Season,"Anime Series, International TV Shows"
Movie,Marvel Super Hero Adventures: Frost Fight!,Mitch Schauer,United States,2015,PG,74 min,"Children & Family Movies, Sci-Fi & Fantasy"
TV Show,Marvel's Agents of S.H.I.E.L.D.,,United States,2020,TV-14,7 Seasons,"TV Action & Adventure, TV Sci-Fi & Fantasy"
TV Show,Marvel's Daredevil,,United States,2018,TV-MA,3 Seasons,"Crime TV Shows, TV Action & Adventure"
Movie,Marvel's Hulk: Where Monsters Dwell,Mitch Schauer,United States,2016,PG,75 min,"Children & Family Movies, Sci-Fi & Fantasy"
TV Show,Marvel's Iron Fist,,United States,2018,TV-MA,2 Seasons,"Crime TV Shows, TV Action & Adventure, TV Dramas"
Movie,Marvel's Iron Man & Hulk: Heroes United,"Leo Riley, Eric Radomski",United States,2013,PG,72 min,"Action & Adventure, Sci-Fi & Fantasy"
TV Show,Marvel's Jessica Jones,,United States,2019,TV-MA,3 Seasons,"Crime TV Shows, TV Action & Adventure, TV Dramas"
TV Show,Marvel's Luke Cage,,United States,2018,TV-MA,2 Seasons,"Crime TV Shows, TV Action & Adventure, TV Dramas"
TV Show,Marvel's The Defenders,,United States,2017,TV-MA,1 Season,"Crime TV Shows, TV Action & Adventure, TV Dramas"
TV Show,Marvel's The Punisher,,United States,2019,TV-MA,2 Seasons,"Crime TV Shows, TV Action & Adventure, TV Thrillers"
Movie,Mary and the Witch's Flower,Hiromasa Yonebayashi,Japan,2017,PG,103 min,"Anime Features, Children & Family Movies"
Movie,Mary Kom,Omung Kumar,India,2014,TV-PG,120 min,"Dramas, International Movies, Sports Movies"
Movie,Mary Magdalene,Garth Davis,"United Kingdom, Australia, United States",2019,R,120 min,"Dramas, Faith & Spirituality, International Movies"
Movie,Mary Poppins Returns,Rob Marshall,"United States, United Kingdom",2018,PG,131 min,"Children & Family Movies, Music & Musicals"
TV Show,Mary Portas: Secret Shopper,,United Kingdom,2016,TV-14,1 Season,"British TV Shows, International TV Shows, Reality TV"
TV Show,Masaba Masaba,,India,2020,TV-MA,1 Season,"International TV Shows, TV Comedies, TV Dramas"
Movie,Masameer - The Movie,Malik Nejer,Saudi Arabia,2020,TV-14,100 min,"Comedies, International Movies"
TV Show,Masameer Classics,,Saudi Arabia,2013,TV-14,4 Seasons,"International TV Shows, TV Comedies"
TV Show,Masameer County,Malik Nejer,,2021,TV-MA,1 Season,"International TV Shows, TV Comedies"
Movie,Mascots,Christopher Guest,United States,2016,TV-MA,95 min,Comedies
TV Show,Masha and the Bear,,Russia,2019,TV-Y,4 Seasons,Kids' TV
TV Show,Masha's Spooky Stories,,"United States, Russia",2012,TV-Y,1 Season,Kids' TV
TV Show,Masha's Tales,,,2012,TV-Y,1 Season,Kids' TV
Movie,Maska,Neeraj Udhwani,India,2020,TV-MA,112 min,"Comedies, Dramas, International Movies"
Movie,Masoom,Shekhar Kapur,India,1983,TV-14,138 min,"Dramas, Independent Movies, International Movies"
Movie,Master,Ui-seok Jo,South Korea,2016,NR,143 min,"Action & Adventure, International Movies"
TV Show,Master of None,,United States,2021,TV-MA,3 Seasons,"TV Comedies, TV Dramas"
Movie,Master Z: The Ip Man Legacy,Yuen Woo-ping,"Hong Kong, China",2018,TV-14,108 min,"Action & Adventure, International Movies"
TV Show,Masters of the Universe: Revelation,,,2021,TV-PG,1 Season,"TV Action & Adventure, TV Sci-Fi & Fantasy"
Movie,Match,Obaid Alhmoudi,,2017,TV-14,91 min,"Dramas, International Movies"
Movie,Mater,Pablo D'Alo Abba,Argentina,2017,TV-MA,80 min,"Dramas, Independent Movies, International Movies"
Movie,Material,Craig Freimond,South Africa,2012,TV-14,94 min,"Comedies, Dramas, International Movies"
Movie,Matichya Chuli,"Sudesh Manjrekar, Atul Kale",India,2006,TV-14,132 min,"Comedies, Dramas, International Movies"
Movie,Mau Nieto: Viviendo sobrio… desde el bar,,Mexico,2018,TV-MA,57 min,Stand-Up Comedy
Movie,Mauli,Aditya Sarpotdar,India,2018,TV-14,136 min,"Action & Adventure, Dramas, International Movies"
Movie,Maurício Meirelles: Generating Chaos,Diego Pignataro,Brazil,2020,TV-MA,63 min,Stand-Up Comedy
Movie,Max Rose,Daniel Noah,United States,2013,TV-14,84 min,"Dramas, Independent Movies"
Movie,Maximum Risk,Ringo Lam,United States,1996,R,101 min,Action & Adventure
Movie,May the Devil Take You,Timo Tjahjanto,Indonesia,2018,TV-MA,111 min,"Horror Movies, International Movies"
Movie,May We Chat,Philip Yung,Hong Kong,2014,TV-MA,99 min,"Dramas, International Movies"
Movie,May You Prosper,"Hassan Hegazy, Shady Ali",Egypt,2017,TV-14,93 min,"Comedies, International Movies, Music & Musicals"
Movie,Maya Angelou: And Still I Rise,"Bob Hercules, Rita Coburn Whack",United States,2016,TV-PG,114 min,Documentaries
Movie,Maya Memsaab,Ketan Mehta,"France, United Kingdom, India",1993,TV-14,122 min,"Dramas, International Movies, Music & Musicals"
Movie,Mayday Life,Muh Chen,"China, Taiwan",2019,TV-PG,120 min,"International Movies, Music & Musicals"
Movie,Maynard,Samuel D. Pollard,United States,2017,TV-PG,100 min,Documentaries
Movie,​Mayurakshi,Atanu Ghosh,India,2017,TV-14,100 min,"Dramas, International Movies"
Movie,Maz Jobrani: Immigrant,Maz Jobrani,,2017,TV-14,67 min,Stand-Up Comedy
Movie,Maza Pati Karodpati,Sachin,India,1988,TV-PG,132 min,"Comedies, International Movies, Romantic Movies"
Movie,Me and the Alien,Jesús Magaña Vázquez,Mexico,2016,TV-MA,83 min,"Comedies, Dramas, International Movies"
Movie,Mea Culpa,"Raúl Campos, Jan Suter",Mexico,2017,TV-MA,54 min,Stand-Up Comedy
Movie,Mean Dreams,Nathan Morlando,Canada,2016,R,105 min,"Dramas, Independent Movies, Thrillers"
Movie,Mean Girls 2,Melanie Mayron,United States,2011,PG-13,98 min,Comedies
Movie,Mean Streets,Martin Scorsese,United States,1973,R,112 min,"Classic Movies, Dramas, Independent Movies"
TV Show,MeatEater,,United States,2021,TV-14,4 Seasons,"Docuseries, Reality TV, Science & Nature TV"
TV Show,Medal of Honor,,United States,2018,TV-MA,1 Season,"Docuseries, TV Dramas"
TV Show,Medical Police,,United States,2020,TV-MA,1 Season,"Crime TV Shows, TV Action & Adventure, TV Comedies"
TV Show,Medici: Masters of Florence,,"Italy, United Kingdom, France",2019,TV-MA,3 Seasons,"International TV Shows, TV Dramas"
Movie,Meditation Park,Mina Shum,Canada,2017,TV-PG,94 min,Dramas
Movie,Medium,Jacek Koprowicz,"Poland, West Germany",1985,TV-MA,90 min,"Horror Movies, International Movies, Thrillers"
TV Show,Meet the Adebanjos,,United Kingdom,2016,TV-PG,3 Seasons,"British TV Shows, International TV Shows, TV Comedies"
Movie,Meet the In-Laws,Niyi Akinmolayan,Nigeria,2017,TV-PG,75 min,"Comedies, Dramas, International Movies"
Movie,Meet the Trumps: From Immigrant to President,"Paul Berczeller, Mark Radice",United Kingdom,2017,TV-14,48 min,Documentaries
TV Show,Mega Food,,United Kingdom,2013,TV-G,1 Season,"British TV Shows, Docuseries, International TV Shows"
TV Show,Megalobox,,Japan,2018,TV-MA,1 Season,"Anime Series, International TV Shows"
TV Show,MegaTruckers,,Australia,2012,TV-PG,1 Season,Reality TV
Movie,Meghnadbodh Rohoshyo,Anik Datta,India,2017,TV-MA,150 min,"Dramas, International Movies"
Movie,Mehandi Circus,Saravana Rajendran,India,2019,TV-MA,126 min,"Dramas, International Movies, Romantic Movies"
Movie,Melle,Binu Ulahhannan,India,2017,TV-PG,110 min,"Dramas, International Movies, Romantic Movies"
TV Show,Melodies of Life - Born This Way,,,2016,TV-14,1 Season,"International TV Shows, Romantic TV Shows, TV Comedies"
Movie,Melvin Goes to Dinner,Bob Odenkirk,United States,2003,R,84 min,"Comedies, Dramas, Independent Movies"
Movie,Memoir of a Murderer,Shin-yeon Won,South Korea,2017,TV-MA,118 min,"Dramas, International Movies, Thrillers"
Movie,Memoirs of a Geisha,Rob Marshall,"France, Japan, United States",2005,PG-13,145 min,"Dramas, Romantic Movies"
Movie,Memories of a Murderer: The Nilsen Tapes,Michael Harte,,2021,TV-MA,86 min,"Documentaries, International Movies"
Movie,Memories of a Teenager,Lucas Santa Ana,Argentina,2019,TV-MA,97 min,"Dramas, International Movies, LGBTQ Movies"
TV Show,Memories of the Alhambra,,South Korea,2018,TV-MA,1 Season,"Crime TV Shows, International TV Shows, Korean TV Shows"
Movie,Memory Games,"Janet Tobias, Claus Wehlisch","Germany, United States, Sweden",2018,TV-14,86 min,Documentaries
TV Show,Memory Love,,,2017,TV-14,1 Season,"International TV Shows, Romantic TV Shows, TV Dramas"
Movie,Men in Black,Barry Sonnenfeld,United States,1997,PG-13,98 min,"Action & Adventure, Comedies, Sci-Fi & Fantasy"
Movie,Men in Black II,Barry Sonnenfeld,United States,2002,PG-13,88 min,"Action & Adventure, Comedies, Sci-Fi & Fantasy"
TV Show,Men on a Mission,Jung-ah Im,South Korea,2021,TV-14,6 Seasons,"International TV Shows, Korean TV Shows, Stand-Up Comedy & Talk Shows"
Movie,Menahi,Ayman Makram,Saudi Arabia,2008,TV-14,101 min,"Comedies, International Movies"
Movie,Menashe,"Josh Z. Weinstein, Joshua Z. Weinstein",United States,2017,PG,82 min,"Dramas, Independent Movies"
Movie,Menorca,John Barnard,"Canada, Spain",2016,TV-MA,81 min,"Dramas, Independent Movies"
Movie,Merantau,Gareth Evans,Indonesia,2009,R,112 min,"Action & Adventure, Dramas, International Movies"
Movie,Merata: How Mum Decolonised the Screen,Hepi Mita,New Zealand,2018,TV-14,88 min,Documentaries
Movie,Mercenary,Sacha Wolff,France,2016,TV-MA,99 min,"Dramas, International Movies, Sports Movies"
Movie,Mercury 13,"David Sington, Heather Walsh",United States,2018,TV-PG,79 min,Documentaries
Movie,Mercy,Chris Sparling,United States,2016,TV-MA,88 min,"Dramas, Thrillers"
Movie,Mercy Black,Owen Egerton,United States,2019,TV-14,88 min,Horror Movies
TV Show,Mere Papa Hero Hiralal,,,2018,TV-14,1 Season,"International TV Shows, TV Dramas"
Movie,Mere Pyare Prime Minister,Rakeysh Omprakash Mehra,India,2019,TV-MA,103 min,"Dramas, International Movies"
Movie,Merku Thodarchi Malai,Lenin Bharathi,India,2018,TV-MA,115 min,"Dramas, Independent Movies, International Movies"
TV Show,Merlí,,Spain,2015,TV-MA,1 Season,"International TV Shows, TV Dramas, Teen TV Shows"
TV Show,Merlin,James Hawes,United Kingdom,2012,TV-PG,5 Seasons,"British TV Shows, International TV Shows, TV Action & Adventure"
TV Show,Merry Happy Whatever,,United States,2019,TV-PG,1 Season,TV Comedies
Movie,Merry Men 2: Another Mission,Moses Inwang,Nigeria,2019,TV-MA,115 min,"Comedies, International Movies"
Movie,Merry Men: The Real Yoruba Demons,Toka McBaror,Nigeria,2018,TV-MA,106 min,"Comedies, International Movies"
Movie,Mersal,Atlee Kumar,India,2017,TV-14,162 min,"Action & Adventure, Dramas, International Movies"
Movie,Message from the King,Fabrice Du Welz,"United Kingdom, France, Belgium, United States",2017,R,103 min,"Independent Movies, Thrillers"
TV Show,Messiah,,United States,2020,TV-MA,1 Season,"TV Dramas, TV Thrillers"
TV Show,Metal Shop Masters,,,2021,TV-MA,1 Season,Reality TV
Movie,Metallica Through The Never,Nimród Antal,United States,2013,R,93 min,Music & Musicals
TV Show,Metallica: Some Kind of Monster,"Joe Berlinger, Bruce Sinofsky",United States,2014,TV-MA,1 Season,TV Shows
TV Show,Meteor Garden,,China,2018,TV-14,1 Season,"International TV Shows, Romantic TV Shows, TV Dramas"
Movie,Metro,Ananda Krishnan,India,2016,TV-14,116 min,"Dramas, International Movies, Thrillers"
Movie,Mexicanos de Bronce,Julio Fernández Talamantes,Mexico,2016,TV-MA,100 min,"Documentaries, International Movies, Music & Musicals"
TV Show,Mexico Diseña,,United States,2016,TV-PG,1 Season,"International TV Shows, Reality TV, Spanish-Language TV Shows"
Movie,MFKZ,"Shojiro Nishimi, Guillaume Renard","France, Japan",2017,R,95 min,"Action & Adventure, Comedies, International Movies"
Movie,Mi amigo Alexis,Alejandro Fernández Almendras,Chile,2019,TV-PG,102 min,"Children & Family Movies, Comedies, Dramas"
Movie,Mi Obra Maestra,Gastón Duprat,"Argentina, Spain",2018,TV-MA,105 min,"Comedies, International Movies"
Movie,Mi Shivajiraje Bhosale Boltoy,Santosh Manjrekar,India,2009,TV-14,148 min,"Comedies, International Movies, Sci-Fi & Fantasy"
Movie,MI-5,Bharat Nalluri,United Kingdom,2015,R,105 min,"Action & Adventure, Dramas, International Movies"
TV Show,Mia and Me,,"Netherlands, Germany, Italy, Canada",2017,TV-Y7,2 Seasons,Kids' TV
Movie,Michael,Ribhu Dasgupta,India,2011,TV-MA,86 min,"Dramas, Independent Movies, International Movies"
Movie,"Michael Bolton's Big, Sexy Valentine's Day Special","Scott Aukerman, Akiva Schaffer",United States,2017,TV-MA,54 min,"Comedies, Music & Musicals, Romantic Movies"
Movie,Michael Che Matters,Oz Rodriguez,United States,2016,TV-MA,61 min,Stand-Up Comedy
Movie,Michael Lost and Found,Daniel Wilner,"Canada, United States",2017,TV-PG,19 min,"Documentaries, International Movies, LGBTQ Movies"
Movie,Michael McIntyre: Showman,Chris Howe,United Kingdom,2020,TV-MA,63 min,Stand-Up Comedy
Movie,Michelle Buteau: Welcome to Buteaupia,Page Hurwitz,United States,2020,TV-MA,59 min,Stand-Up Comedy
Movie,Michelle Wolf: Joke Show,Lance Bangs,United States,2019,TV-MA,60 min,Stand-Up Comedy
Movie,Middle Men,George Gallo,United States,2009,R,113 min,"Comedies, Dramas, Independent Movies"
Movie,Middle of Nowhere,Ava DuVernay,United States,2012,R,102 min,"Dramas, Independent Movies, Romantic Movies"
Movie,Middle School: The Worst Years of My Life,Steve Carr,"United States, Cambodia",2016,PG,92 min,"Children & Family Movies, Comedies"
TV Show,Middleditch & Schwartz,Ryan Polito,United States,2020,TV-MA,1 Season,TV Comedies
Movie,Midnight at the Magnolia,Maxwell McGuire,Canada,2020,TV-G,87 min,"Comedies, Romantic Movies"
TV Show,Midnight Diner,,Japan,2014,TV-MA,3 Seasons,"International TV Shows, TV Dramas"
TV Show,Midnight Diner: Tokyo Stories,,Japan,2019,TV-MA,2 Seasons,"International TV Shows, TV Dramas"
TV Show,Midnight Mass,Mike Flanagan,,2021,TV-MA,1 Season,"TV Dramas, TV Horror, TV Mysteries"
TV Show,Midnight Misadventures With Mallika Dua,,India,2018,TV-14,1 Season,"International TV Shows, Stand-Up Comedy & Talk Shows, TV Comedies"
Movie,Midnight Run,Martin Brest,United States,1988,R,126 min,"Action & Adventure, Classic Movies, Comedies"
Movie,Midnight Special,Jeff Nichols,"United States, Greece",2016,PG-13,112 min,"Action & Adventure, Sci-Fi & Fantasy"
Movie,Midnight Sun,Scott Speer,United States,2018,PG-13,91 min,"Dramas, Romantic Movies"
TV Show,Mighty Express,,"United States, Canada",2021,TV-Y,4 Seasons,Kids' TV
Movie,Mighty Express: A Mighty Christmas,Clint Butler,Canada,2020,TV-Y,26 min,Children & Family Movies
TV Show,Mighty Little Bheem,,,2020,TV-Y,3 Seasons,"Kids' TV, TV Comedies"
TV Show,Mighty Little Bheem: Diwali,,India,2019,TV-Y,1 Season,"Kids' TV, TV Comedies"
TV Show,Mighty Little Bheem: Festival of Colors,,India,2020,TV-Y,1 Season,"Kids' TV, TV Comedies"
TV Show,Mighty Little Bheem: Kite Festival,,India,2021,TV-Y,1 Season,"Kids' TV, TV Comedies"
TV Show,Mighty Morphin Alien Rangers,,,1996,TV-Y7,1 Season,Kids' TV
TV Show,Mighty Morphin Power Rangers,,"United States, Japan",2010,TV-Y7,4 Seasons,Kids' TV
TV Show,Mighty Raju,,,2017,TV-Y7,4 Seasons,Kids' TV
Movie,Mighty Raju Rio Calling,"Rajiv Chilaka, Anirban Majumder, Alka Amarkant Dubey",India,2014,TV-Y7,97 min,"Children & Family Movies, Sports Movies"
Movie,Mike Birbiglia: My Girlfriend's Boyfriend,Seth Barrish,United States,2013,TV-14,76 min,Stand-Up Comedy
Movie,Mike Birbiglia: Thank God for Jokes,"Seth Barrish, Mike Birbiglia",United States,2017,TV-MA,71 min,Stand-Up Comedy
Movie,Mike Birbiglia: The New One,Seth Barrish,United States,2019,TV-MA,86 min,Stand-Up Comedy
Movie,Mike Birbiglia: What I Should Have Said Was Nothing: Tales from My Secret Public Journal,,United States,2008,TV-MA,56 min,Stand-Up Comedy
Movie,Mike Epps: Don't Take It Personal,L. Frazier,United States,2015,TV-MA,60 min,Stand-Up Comedy
Movie,Mike Epps: Only One Mike,Kevin Bray,United States,2019,TV-MA,63 min,Stand-Up Comedy
Movie,Milada,David Mrnka,"Czech Republic, United States",2017,TV-14,124 min,"Dramas, International Movies"
Movie,Mile 22,Peter Berg,"United States, China, Colombia",2018,R,94 min,Action & Adventure
Movie,Milea,"Fajar Bustomi, Pidi Baiq",Indonesia,2020,TV-14,100 min,"Dramas, International Movies, Romantic Movies"
Movie,Miles Davis: Birth of the Cool,Stanley Nelson,United States,2019,TV-MA,115 min,"Documentaries, Music & Musicals"
Movie,Milestone,Ivan Ayr,India,2021,TV-14,98 min,"Dramas, Independent Movies, International Movies"
Movie,MILF,Axelle Laffont,"France, Belgium",2018,TV-MA,102 min,"Comedies, International Movies, Romantic Movies"
Movie,Milk,Gus Van Sant,United States,2008,R,128 min,"Dramas, Independent Movies, LGBTQ Movies"
Movie,Milkwater,Morgan Ingari,United States,2020,TV-MA,102 min,"Comedies, Dramas, Independent Movies"
TV Show,Millennials,,Argentina,2020,TV-MA,3 Seasons,"International TV Shows, Romantic TV Shows, Spanish-Language TV Shows"
Movie,Million Dollar Baby,Clint Eastwood,United States,2004,PG-13,133 min,"Dramas, Sports Movies"
TV Show,Million Dollar Beach House,,United States,2020,TV-MA,1 Season,Reality TV
TV Show,Million Pound Menu,,United Kingdom,2019,TV-MA,2 Seasons,"British TV Shows, International TV Shows, Reality TV"
TV Show,Million Yen Women,,Japan,2017,TV-MA,1 Season,"Crime TV Shows, International TV Shows, TV Dramas"
Movie,Mimi,Laxman Utekar,,2021,TV-14,132 min,"Comedies, Dramas, International Movies"
TV Show,Mind Game,,Singapore,2015,TV-14,1 Season,"Crime TV Shows, International TV Shows, TV Dramas"
Movie,MindGamers,Andrew Goth,Austria,2017,R,99 min,"International Movies, Sci-Fi & Fantasy, Thrillers"
Movie,Mindhorn,Sean Foley,United Kingdom,2017,TV-MA,88 min,"Comedies, Cult Movies, Independent Movies"
TV Show,MINDHUNTER,,United States,2019,TV-MA,2 Seasons,"Crime TV Shows, TV Dramas, TV Mysteries"
TV Show,Mine,,South Korea,2021,TV-14,1 Season,"International TV Shows, TV Dramas"
Movie,Mine 9,Eddie Mensore,United States,2019,TV-MA,83 min,"Dramas, Independent Movies"
TV Show,Minecraft: Story Mode,,"United States, Sweden",2015,TV-PG,1 Season,Kids' TV
TV Show,Mini Wolf,,France,2014,TV-G,2 Seasons,Kids' TV
TV Show,Miniforce,,,2016,TV-Y7,1 Season,"Kids' TV, Korean TV Shows"
TV Show,Miniforce X,,South Korea,2018,TV-Y7,1 Season,"Kids' TV, Korean TV Shows"
TV Show,Miniforce: Super Dino Power,,,2020,TV-Y7,1 Season,Kids' TV
Movie,Minimalism: A Documentary About the Important Things,Matt D'Avella,United States,2016,TV-14,78 min,Documentaries
Movie,Minnaminugu the FireFly,Anil Thomas,India,2017,TV-14,128 min,"Dramas, International Movies"
Movie,Minsara Kanavu,Rajiv Menon,,1997,TV-PG,147 min,"Comedies, International Movies, Music & Musicals"
TV Show,Minute to Win It,,United States,2013,TV-PG,1 Season,Reality TV
Movie,Miracle,Gavin O'Connor,"Canada, United States",2004,PG,136 min,"Children & Family Movies, Dramas, Sports Movies"
Movie,Miracle in Cell No. 7,Mehmet Ada Öztekin,Turkey,2019,TV-14,132 min,"Dramas, International Movies"
TV Show,Miraculous: Tales of Ladybug & Cat Noir,Thomas Astruc,"France, South Korea, Japan, United States",2019,TV-Y7,5 Seasons,"Kids' TV, TV Action & Adventure"
Movie,Mirage,Oriol Paulo,Spain,2018,TV-MA,129 min,"Dramas, International Movies, Sci-Fi & Fantasy"
Movie,Mirai,Mamoru Hosoda,"Japan, United States",2018,PG,98 min,"Action & Adventure, Anime Features, Children & Family Movies"
Movie,Miranda Sings Live…Your Welcome,Marcus Raboy,United States,2019,TV-14,62 min,Stand-Up Comedy
Movie,Mirror Mirror,Tarsem Singh,"United States, Canada",2012,PG,106 min,"Children & Family Movies, Comedies"
Movie,Mirzya,Rakeysh Omprakash Mehra,India,2016,TV-MA,129 min,"Dramas, International Movies, Music & Musicals"
TV Show,Misaeng,,South Korea,2014,TV-MA,1 Season,"International TV Shows, Korean TV Shows, TV Dramas"
Movie,Mischief,Emcy Joseph,India,2019,TV-PG,120 min,"Comedies, Dramas, Independent Movies"
Movie,Misfit,Erwin van den Eshof,Netherlands,2017,TV-14,81 min,"Children & Family Movies, Comedies, International Movies"
Movie,Misfit 2,Erwin van den Eshof,Netherlands,2019,TV-G,82 min,"Children & Family Movies, Comedies, International Movies"
Movie,Misha and the Wolves,Sam Hobkinson,"Belgium, United Kingdom",2021,PG-13,90 min,"Documentaries, International Movies"
TV Show,Mismatched,,India,2020,TV-MA,1 Season,"International TV Shows, Romantic TV Shows, TV Comedies"
Movie,Miss Americana,Lana Wilson,United States,2020,TV-MA,85 min,"Documentaries, Music & Musicals"
