type,title,director,country,release_year,rating,duration,listed_in
Movie,SunGanges,Valli Bindana,"India, United States",2018,TV-14,74 min,"Documentaries, International Movies"
TV Show,Sunny Bunnies,,Belarus,2016,TV-Y,2 Seasons,"British TV Shows, Kids' TV, TV Comedies"
Movie,Sunrise,Partho Sen-Gupta,"India, France",2014,TV-MA,85 min,"Dramas, Independent Movies, International Movies"
TV Show,Super Bheem,,India,2019,TV-Y,1 Season,Kids' TV
Movie,Super Bheem Bana Vajraveer,Sumit Das,India,2018,TV-Y7,63 min,Children & Family Movies
Movie,Super Dark Times,Kevin Phillips,United States,2017,TV-MA,104 min,"Dramas, Independent Movies, Thrillers"
Movie,Super Deluxe,Thiagarajan Kumararaja,India,2019,TV-MA,176 min,"Comedies, Dramas, International Movies"
TV Show,Super Drags,,Brazil,2018,TV-MA,1 Season,"International TV Shows, TV Comedies"
Movie,Super Me,Zhang Chong,China,2021,TV-14,104 min,"Action & Adventure, Dramas, International Movies"
TV Show,Super Monsters,,,2019,TV-Y,3 Seasons,Kids' TV
Movie,Super Monsters and the Wish Star,Jacob Joice,,2018,TV-Y,28 min,Children & Family Movies
Movie,Super Monsters Back to School,,Canada,2019,TV-Y,24 min,Children & Family Movies
Movie,Super Monsters Furever Friends,,,2019,TV-Y,59 min,Children & Family Movies
TV Show,Super Monsters Monster Party,,,2018,TV-Y,1 Season,Kids' TV
TV Show,Super Monsters Monster Pets,,United States,2019,TV-Y,1 Season,Kids' TV
Movie,Super Monsters Save Christmas,Steve Ball,United States,2019,TV-Y,24 min,Children & Family Movies
Movie,Super Monsters Save Halloween,,,2018,TV-Y,25 min,Children & Family Movies
Movie,Super Monsters: Dia de los Monsters,,Canada,2020,TV-Y,25 min,Children & Family Movies
Movie,Super Monsters: Once Upon a Rhyme,Steve Ball,,2021,TV-Y,25 min,Children & Family Movies
Movie,Super Monsters: Santa’s Super Monster Helpers,Steve Ball,,2020,TV-Y,24 min,Children & Family Movies
Movie,Super Monsters: The New Class,Steve Ball,Canada,2020,TV-Y,25 min,Children & Family Movies
Movie,Super Monsters: Vida's First Halloween,"Jacob Joice, Steve Ball",United States,2019,TV-Y,24 min,Children & Family Movies
Movie,Super Nani,Indra Kumar,India,2014,TV-PG,127 min,"Comedies, Dramas, International Movies"
TV Show,Super Wings,,"United States, South Korea, China",2020,TV-Y,3 Seasons,"Kids' TV, Korean TV Shows"
Movie,Superbad,Greg Mottola,United States,2007,R,113 min,"Comedies, Cult Movies"
Movie,Superfly,Gordon Parks,United States,1972,R,91 min,"Action & Adventure, Classic Movies, Dramas"
TV Show,Supergirl,Jesse Warn,United States,2019,TV-14,5 Seasons,"TV Action & Adventure, TV Sci-Fi & Fantasy"
Movie,Superlopez,Javier Ruiz Caldera,Spain,2018,TV-MA,108 min,"Action & Adventure, Comedies, International Movies"
Movie,Superman Returns,Bryan Singer,United States,2006,PG-13,154 min,"Action & Adventure, Sci-Fi & Fantasy"
TV Show,Supermarket Sweep,,United States,1993,TV-G,1 Season,Reality TV
TV Show,Supernatural,Phil Sgriccia,"United States, Canada",2019,TV-14,15 Seasons,"Classic & Cult TV, TV Action & Adventure, TV Horror"
TV Show,SuperNature: Wild Flyers,,United Kingdom,2016,TV-PG,1 Season,"British TV Shows, Docuseries, Science & Nature TV"
Movie,Superstar,Bruce McCulloch,United States,1999,PG-13,82 min,Comedies
Movie,Sur Sapata,Mangesh Kanthale,India,2019,TV-14,140 min,"Comedies, Dramas, International Movies"
Movie,Sur: The Melody of Life,Tanuja Chandra,India,2002,TV-14,137 min,"Dramas, International Movies"
Movie,Surat Dari Praha,Angga Dwimas Sasongko,Indonesia,2016,TV-14,98 min,"Dramas, International Movies, Romantic Movies"
Movie,Surf's Up,"Ash Brannon, Chris Buck","United States, Canada",2007,PG,86 min,"Children & Family Movies, Comedies, Sports Movies"
Movie,Surga Yang Tak Dirindukan,Kuntz Agus,Indonesia,2015,TV-14,121 min,"Dramas, Faith & Spirituality, International Movies"
Movie,Surga Yang Tak Dirindukan 2,"Hanung Bramantyo, Meisa Felaroze",Indonesia,2017,TV-14,119 min,"Dramas, Faith & Spirituality, International Movies"
TV Show,Surviving Death,,United States,2021,TV-MA,1 Season,"Docuseries, Reality TV"
TV Show,Surviving Escobar - Alias JJ,,,2017,TV-MA,1 Season,"Crime TV Shows, International TV Shows, Spanish-Language TV Shows"
TV Show,Surviving R. Kelly,,United States,2019,TV-MA,1 Season,"Crime TV Shows, Docuseries"
TV Show,Surviving R. Kelly Part II: The Reckoning,,United States,2020,TV-MA,1 Season,"Crime TV Shows, Docuseries"
Movie,Surviving R. Kelly: The Impact,,United States,2019,TV-14,85 min,Documentaries
TV Show,Survivor,,United States,2014,TV-14,2 Seasons,Reality TV
Movie,Survivors Guide to Prison,Matthew Cooke,United States,2017,TV-MA,103 min,Documentaries
Movie,Susanne Bartsch: On Top,"Anthony Caronna, Alexander Smith",United States,2017,TV-MA,86 min,"Documentaries, LGBTQ Movies"
Movie,Sustainable,Matt Wechsler,United States,2016,TV-G,92 min,Documentaries
Movie,Suzzanna: Buried Alive,"Rocky Soraya, Anggy Umbara",Indonesia,2018,TV-MA,126 min,"Horror Movies, International Movies"
Movie,Svaha: The Sixth Finger,Jang Jae-hyun,South Korea,2019,TV-MA,123 min,"International Movies, Thrillers"
Movie,Swades,Ashutosh Gowariker,India,2004,TV-PG,185 min,"Dramas, International Movies"
Movie,Swami,Basu Chatterjee,India,1977,TV-PG,123 min,"Dramas, Independent Movies, International Movies"
TV Show,Swami Baba Ramdev: The Untold Story,,,2018,TV-14,1 Season,"International TV Shows, TV Dramas"
Movie,Swearnet Live,"Mike Smith, John Paul Tremblay, Robb Wells",Canada,2014,TV-MA,75 min,"Comedies, International Movies"
Movie,Swearnet: The Movie,Warren P. Sonoda,Canada,2014,NC-17,112 min,"Comedies, International Movies"
Movie,Sweeney Todd: The Demon Barber of Fleet Street,Tim Burton,"United States, United Kingdom",2007,R,116 min,"Dramas, Horror Movies, Music & Musicals"
Movie,Sweet & Sour,Lee Kae-byeok,South Korea,2021,TV-14,103 min,"Comedies, International Movies, Romantic Movies"
Movie,Sweet Girl,Brian Andrew Mendoza,United States,2021,R,110 min,"Action & Adventure, Dramas"
TV Show,Sweet Magnolias,,United States,2020,TV-14,1 Season,"Romantic TV Shows, TV Dramas"
TV Show,Sweet Tooth,,United States,2021,TV-14,1 Season,"TV Action & Adventure, TV Dramas, TV Sci-Fi & Fantasy"
Movie,Sweet Virginia,Jamie M. Dagg,"United States, Canada",2017,R,93 min,"Dramas, Independent Movies, Thrillers"
Movie,Sweetheart,J.D. Dillard,United States,2019,PG-13,83 min,"Horror Movies, Sci-Fi & Fantasy, Thrillers"
Movie,Swiped,Ann Deborah Fishman,United States,2018,TV-14,94 min,Comedies
Movie,Swiss Army Man,"Dan Kwan, Daniel Scheinert","United States, Sweden",2016,R,97 min,"Comedies, Dramas, Independent Movies"
TV Show,Switched,,Japan,2018,TV-MA,1 Season,"International TV Shows, TV Dramas, TV Mysteries"
TV Show,Sword Art Online,,Japan,2018,TV-MA,3 Seasons,"Anime Series, International TV Shows"
TV Show,Sword Art Online Alternative: Gun Gale Online,,Japan,2018,TV-MA,1 Season,"Anime Series, International TV Shows"
Movie,Sword Master,Derek Yee,"China, Hong Kong",2016,TV-MA,108 min,"Action & Adventure, Dramas, International Movies"
Movie,Sword Masters: Two Champions of Shaolin,Cheh Chang,Hong Kong,1980,R,101 min,"Action & Adventure, International Movies"
Movie,Sword of Trust,Lynn Shelton,United States,2019,R,89 min,"Comedies, Dramas, Independent Movies"
Movie,Swordfish,Dominic Sena,United States,2001,R,99 min,Action & Adventure
TV Show,SWORDGAI The Animation,,Japan,2018,TV-MA,2 Seasons,"Anime Series, International TV Shows"
Movie,Sylvia,Daniel Oriahi,Nigeria,2018,TV-14,104 min,"Dramas, International Movies, Thrillers"
TV Show,Sym-Bionic Titan,,United States,2010,TV-PG,1 Season,Kids' TV
Movie,Synchronic,"Justin Benson, Aaron Moorhead",United States,2020,R,102 min,Thrillers
Movie,System Crasher,Nora Fingscheidt,Germany,2020,TV-MA,120 min,"Dramas, Independent Movies, International Movies"
Movie,Taal,Subhash Ghai,India,1999,TV-PG,177 min,"Dramas, International Movies, Music & Musicals"
Movie,Taare Zameen Par,Aamir Khan,India,2007,PG,162 min,"Dramas, International Movies"
Movie,Table Manners,Leli Maki,"Canada, South Africa",2018,TV-MA,104 min,"Comedies, Dramas, International Movies"
TV Show,Tabula Rasa,,Belgium,2017,TV-MA,1 Season,"International TV Shows, TV Dramas, TV Mysteries"
TV Show,Taco Chronicles,,United States,2020,TV-MA,2 Seasons,"Docuseries, International TV Shows, Reality TV"
Movie,Tahaan,Santosh Sivan,India,2008,TV-14,95 min,"Dramas, International Movies"
TV Show,Taj Mahal 1989,,India,2020,TV-MA,1 Season,"International TV Shows, Romantic TV Shows, TV Comedies"
Movie,Take Me,Pat Healy,United States,2017,TV-MA,84 min,"Comedies, Independent Movies"
Movie,Take Me Home Tonight,Michael Dowse,"United States, Germany",2011,R,97 min,"Comedies, Romantic Movies"
TV Show,Take My Brother Away,Han Qing,China,2018,TV-14,1 Season,"International TV Shows, TV Comedies, TV Dramas"
Movie,Take the 10,Chester Tam,United States,2017,TV-MA,80 min,Comedies
Movie,"Take the Ball, Pass the Ball",Duncan McMath,Spain,2018,TV-MA,109 min,"Documentaries, International Movies, Sports Movies"
Movie,Take Your Pills,Alison Klayman,United States,2018,TV-14,88 min,Documentaries
TV Show,Taken,,"France, United States",2018,TV-14,2 Seasons,"Crime TV Shows, TV Action & Adventure, TV Thrillers"
Movie,Takers,John Luessenhop,United States,2010,PG-13,107 min,Action & Adventure
Movie,Takizawa Kabuki ZERO 2020 The Movie,Hideaki Takizawa,,2020,TV-PG,139 min,"International Movies, Music & Musicals"
TV Show,Takki,,Saudi Arabia,2014,TV-14,2 Seasons,"International TV Shows, TV Dramas"
Movie,Talaash,Reema Kagti,India,2012,TV-14,140 min,"Dramas, International Movies, Thrillers"
Movie,Talentime,Yasmin Ahmad,Malaysia,2009,TV-14,120 min,"Dramas, International Movies, Romantic Movies"
TV Show,Tales by Light,,Australia,2018,TV-14,3 Seasons,"Docuseries, International TV Shows, Science & Nature TV"
Movie,Tales From the Hood 2,"Rusty Cundieff, Darin Scott",United States,2018,R,110 min,"Cult Movies, Horror Movies, Independent Movies"
TV Show,Tales of the City,,United States,2019,TV-MA,1 Season,TV Dramas
TV Show,Tales of the City (1993),,"United Kingdom, United States",1993,TV-MA,1 Season,TV Dramas
TV Show,Talking Tom and Friends,,Cyprus,2017,TV-Y,1 Season,"Kids' TV, TV Comedies"
Movie,Tall Girl,Nzingha Stewart,United States,2019,TV-PG,103 min,"Children & Family Movies, Comedies, Romantic Movies"
Movie,Talladega Nights: The Ballad of Ricky Bobby,Adam McKay,United States,2006,PG-13,108 min,"Action & Adventure, Comedies, Sports Movies"
Movie,Tallulah,Sian Heder,United States,2016,TV-MA,112 min,"Dramas, Independent Movies"
Movie,Tamanchey,Navneet Behal,India,2014,TV-MA,111 min,"Action & Adventure, International Movies, Romantic Movies"
Movie,Tamasha,Imtiaz Ali,India,2015,TV-14,133 min,"Dramas, International Movies, Romantic Movies"
Movie,Tanda Tanya,Hanung Bramantyo,Indonesia,2011,TV-MA,102 min,"Dramas, International Movies"
TV Show,Tango,,Lebanon,2018,TV-14,1 Season,"International TV Shows, Romantic TV Shows, TV Dramas"
Movie,Tango Feroz,Marcelo Piñeyro,"Argentina, Spain",1993,TV-MA,124 min,"Classic Movies, Dramas, International Movies"
Movie,Tango With Me,Mahmood Ali-Balogun,Nigeria,2010,TV-14,104 min,"Dramas, International Movies, Romantic Movies"
Movie,Tanu Weds Manu,Aanand Rai,India,2011,TV-14,114 min,"Comedies, Dramas, International Movies"
Movie,Taramani,Ram,India,2017,TV-MA,148 min,"Dramas, Independent Movies, International Movies"
Movie,Tarek's Situation,Wael Ehsan,Egypt,2006,TV-14,110 min,"Comedies, International Movies, Romantic Movies"
Movie,Target,Raditya Dika,Indonesia,2018,TV-14,91 min,"Comedies, Horror Movies, International Movies"
Movie,Tarif de nuit,Julien Seri,France,2015,TV-MA,81 min,"International Movies, Thrillers"
Movie,Tarung Sarung,Archie Hekagery,Indonesia,2020,TV-PG,116 min,"Action & Adventure, Dramas, Faith & Spirituality"
Movie,Tarzan,"Chris Buck, Kevin Lima",United States,1999,G,89 min,Children & Family Movies
Movie,Tarzan 2,Brian Smith,United States,2005,G,72 min,Children & Family Movies
Movie,Tattah,Sameh Abdulaziz,Egypt,2013,TV-14,112 min,"Comedies, International Movies"
TV Show,Tattoo Redo,,,2021,TV-MA,1 Season,Reality TV
Movie,Tatu,Don Omope,Nigeria,2017,TV-MA,101 min,"Action & Adventure, Dramas, International Movies"
Movie,TAU,Federico D'Alessandro,United States,2018,R,98 min,"Sci-Fi & Fantasy, Thrillers"
Movie,Taxi Ballad,Daniel Joseph,"Lebanon, United States, United Arab Emirates",2012,TV-MA,81 min,"Dramas, International Movies"
Movie,Taxi Driver,Daniel Oriahi,Nigeria,2015,TV-MA,94 min,"Comedies, Dramas, Independent Movies"
Movie,Taxi No. 9211,Milan Luthria,,2006,TV-14,116 min,"Dramas, International Movies, Thrillers"
TV Show,Tayee,,Egypt,2018,TV-MA,1 Season,"International TV Shows, TV Dramas"
Movie,Taylor Swift reputation Stadium Tour,Paul Dugdale,,2018,TV-PG,125 min,Music & Musicals
Movie,Taylor Tomlinson: Quarter-Life Crisis,Marcus Raboy,United States,2020,TV-MA,61 min,Stand-Up Comedy
TV Show,Tayo and Little Wizards,,,2020,TV-Y7,1 Season,Kids' TV
TV Show,Tayo the Little Bus,,South Korea,2016,TV-Y,2 Seasons,"Kids' TV, Korean TV Shows"
Movie,Tayo the Little Bus Movie: Mission Ace,Ryu Jung-woo,United States,2016,TV-Y7,48 min,Children & Family Movies
Movie,TE3N,Ribhu Dasgupta,India,2016,TV-14,128 min,"Dramas, International Movies, Thrillers"
Movie,Teach Us All,Sonia Lowman,United States,2017,TV-14,81 min,Documentaries
Movie,Team America: World Police,Trey Parker,"United States, Germany",2004,R,98 min,"Action & Adventure, Comedies, Cult Movies"
Movie,Team Foxcatcher,Jon Greenhalgh,United States,2016,TV-MA,91 min,"Documentaries, Sports Movies"
TV Show,Team Kaylie,,United States,2020,TV-PG,3 Seasons,"Kids' TV, TV Comedies"
Movie,Tears of the Sun,Antoine Fuqua,United States,2003,R,121 min,"Action & Adventure, Dramas"
TV Show,Teasing Master Takagi-san,,Japan,2019,TV-PG,1 Season,"Anime Series, International TV Shows, Romantic TV Shows"
Movie,Tee Shot: Ariya Jutanugarn,Tanawat Aiemjinda,Thailand,2019,TV-14,103 min,"Children & Family Movies, Dramas, International Movies"
Movie,Teefa in Trouble,Ahsan Rahim,Pakistan,2018,TV-14,155 min,"Action & Adventure, Comedies, International Movies"
Movie,Teen Aur Aadha,Dar Gai,India,2018,TV-MA,119 min,"Dramas, Independent Movies, International Movies"
TV Show,Teen Mom 2,,United States,2011,TV-14,2 Seasons,Reality TV
Movie,Teen Patti,Leena Yadav,India,2010,TV-PG,137 min,"Dramas, International Movies, Thrillers"
TV Show,Teenage Bounty Hunters,,United States,2020,TV-MA,1 Season,"Crime TV Shows, TV Comedies, TV Dramas"
Movie,Teenage Cocktail,John Carchietta,United States,2016,TV-MA,89 min,"Dramas, Independent Movies, LGBTQ Movies"
Movie,Teenage Mutant Ninja Turtles,Kevin Munroe,"Hong Kong, United States",2007,PG,87 min,"Children & Family Movies, Comedies"
Movie,Teenage Mutant Ninja Turtles II: The Secret of the Ooze,Michael Pressman,"United States, Hong Kong",1991,PG,88 min,"Children & Family Movies, Comedies"
Movie,Teenage Mutant Ninja Turtles: The Movie,Steve Barron,,1990,PG,94 min,"Action & Adventure, Comedies"
Movie,Tees Maar Khan,Farah Khan,India,2010,TV-PG,125 min,"Comedies, International Movies, Music & Musicals"
Movie,Tell Me When,Gerardo Gatica,Mexico,2021,TV-MA,97 min,"Comedies, International Movies"
Movie,Tell Me Who I Am,Ed Perkins,United Kingdom,2019,TV-MA,86 min,Documentaries
Movie,Tellur Aliens,Einar Gabbassov,"United States, Kazakhstan",2016,TV-Y7,67 min,Children & Family Movies
Movie,Temple,Michael Barrett,"Japan, United States",2017,TV-MA,78 min,"Horror Movies, Independent Movies"
Movie,Temporada de Caza,Natalia Garagiola,"Argentina, France, United States, Germany, Qatar",2017,TV-MA,108 min,"Dramas, International Movies"
Movie,Ten Years,"Jevons Au, Zune Kwok, Chow Kwun-wai, Ng Ka-Leung, Wong Fei-Pang",Hong Kong,2015,TV-MA,102 min,"Dramas, Independent Movies, International Movies"
Movie,Tenacious D in The Pick of Destiny,Liam Lynch,"United States, Germany",2006,R,94 min,"Comedies, Cult Movies, Music & Musicals"
Movie,Tere Naal Love Ho Gaya,Mandeep Kumar,India,2012,TV-14,127 min,"Comedies, International Movies, Romantic Movies"
TV Show,Teresa,,Mexico,2010,TV-PG,1 Season,"International TV Shows, Romantic TV Shows, Spanish-Language TV Shows"
Movie,Term Life,Peter Billingsley,United States,2016,R,93 min,"Dramas, Thrillers"
Movie,Terminator 3: Rise of the Machines,Jonathan Mostow,"United States, Germany, United Kingdom",2003,R,109 min,"Action & Adventure, Sci-Fi & Fantasy"
Movie,Terminator Salvation,McG,"United States, Germany, United Kingdom, Italy",2009,PG-13,115 min,"Action & Adventure, Sci-Fi & Fantasy"
Movie,Terra,"Yann Arthus-Bertrand, Michael Pitiot",France,2015,TV-PG,98 min,"Documentaries, International Movies"
TV Show,Terrace House: Aloha State,,"United States, Japan",2017,TV-14,4 Seasons,"International TV Shows, Reality TV"
TV Show,Terrace House: Boys & Girls in the City,,Japan,2016,TV-14,2 Seasons,"International TV Shows, Reality TV"
TV Show,Terrace House: Opening New Doors,,Japan,2018,TV-14,6 Seasons,"International TV Shows, Reality TV"
TV Show,Terrace House: Tokyo 2019-2020,,Japan,2019,TV-MA,2 Seasons,"International TV Shows, Reality TV"
Movie,Terrifier,Damien Leone,United States,2017,TV-MA,84 min,"Horror Movies, Independent Movies, Thrillers"
TV Show,Terrorism Close Calls,,"United States, Czech Republic",2018,TV-MA,1 Season,"Crime TV Shows, Docuseries, International TV Shows"
Movie,Tersanjung the Movie,"Hanung Bramantyo, Pandu Adjisurya",Indonesia,2021,TV-14,114 min,"Dramas, International Movies, Romantic Movies"
Movie,Teshan,Sukhbir Singh,India,2016,TV-PG,133 min,"Comedies, International Movies, Romantic Movies"
Movie,Tezz,Priyadarshan,"United Kingdom, India",2012,TV-MA,121 min,"Action & Adventure, International Movies, Music & Musicals"
TV Show,Th Eena Meena Deeka Chase Comedy Show,Dheeraj Berry,India,2015,TV-Y7,1 Season,"Kids' TV, TV Comedies"
Movie,Thaandavam,Vijay,India,2012,TV-14,156 min,"Action & Adventure, International Movies, Music & Musicals"
TV Show,Thackeray,,India,2019,TV-MA,1 Season,TV Shows
Movie,Thackeray (Hindi),Abhijit Panse,India,2019,TV-14,135 min,"Dramas, International Movies"
Movie,Thackeray (Marathi),Abhijit Panse,,2019,TV-14,135 min,"Dramas, International Movies"
Movie,Thambi,Jeethu Joseph,India,2019,TV-14,148 min,"International Movies, Thrillers"
Movie,Thank You,Anees Bazmee,India,2011,TV-14,131 min,"Comedies, International Movies, Romantic Movies"
TV Show,That '70s Show,,United States,2005,TV-14,8 Seasons,TV Comedies
Movie,That Thing Called Tadhana,Antoinette Jadaone,Philippines,2015,TV-MA,91 min,"Dramas, International Movies, Romantic Movies"
TV Show,"That Winter, the Wind Blows",,South Korea,2013,TV-MA,1 Season,"International TV Shows, Korean TV Shows, Romantic TV Shows"
TV Show,The 10 Sins,,,2018,TV-14,1 Season,"International TV Shows, TV Dramas"
TV Show,The 100,,"United States, Canada",2020,TV-MA,7 Seasons,"TV Action & Adventure, TV Dramas, TV Sci-Fi & Fantasy"
Movie,The 101-Year-Old Man Who Skipped Out on the Bill and Disappeared,"Felix Herngren, Måns Herngren",Sweden,2016,TV-MA,108 min,"Comedies, International Movies"
Movie,The 12th Man,Harald Zwart,Norway,2018,TV-MA,130 min,"Action & Adventure, Dramas, International Movies"
TV Show,The 2000s,,United States,2018,TV-MA,1 Season,Docuseries
Movie,The 24 Hour War,"Nate Adams, Adam Carolla",United States,2016,TV-MA,100 min,"Documentaries, Sports Movies"
Movie,The 2nd,Brian Skiba,United States,2020,TV-MA,93 min,Action & Adventure
Movie,The 3rd Eye,Rocky Soraya,Indonesia,2018,TV-MA,108 min,"Horror Movies, International Movies"
Movie,The 3rd Eye 2,Rocky Soraya,Indonesia,2019,TV-MA,117 min,"Horror Movies, International Movies"
TV Show,The 43,,,2019,TV-MA,1 Season,"Crime TV Shows, Docuseries, International TV Shows"
TV Show,The 4400,,"United States, United Kingdom",2007,TV-14,4 Seasons,"TV Dramas, TV Mysteries, TV Sci-Fi & Fantasy"
Movie,The 4th Company,"Mitzi Vanessa Arreola, Amir Galvan Cervera","Mexico, Spain",2016,TV-MA,117 min,"Action & Adventure, Dramas, International Movies"
Movie,The 8th Night,Kim Tae-hyung,South Korea,2021,TV-14,116 min,"Horror Movies, International Movies, Thrillers"
Movie,The 9th Precinct,Ding-Lin Wang,Taiwan,2019,TV-MA,95 min,"International Movies, Thrillers"
TV Show,The A List,,United Kingdom,2021,TV-PG,2 Seasons,"British TV Shows, International TV Shows, TV Dramas"
Movie,The Accidental Spy,Roger Russell,Nigeria,2017,TV-MA,104 min,"Action & Adventure, Comedies, International Movies"
Movie,The Accountant of Auschwitz,Matthew Shoychet,Canada,2018,TV-14,78 min,"Documentaries, International Movies"
Movie,The Adderall Diaries,Pamela Romanowsky,United States,2015,R,87 min,"Dramas, Thrillers"
TV Show,The Adjusters,,,2010,TV-PG,2 Seasons,"International TV Shows, TV Dramas"
Movie,The Adventure Club,Geoff Anderson,Canada,2016,TV-Y7,88 min,Children & Family Movies
TV Show,The Adventures of Figaro Pho,,Australia,2015,TV-Y7,2 Seasons,"Kids' TV, TV Comedies"
TV Show,The Adventures of Puss in Boots,,United States,2018,TV-Y7,6 Seasons,"Kids' TV, TV Comedies"
Movie,The Adventures of Sharkboy and Lavagirl,Robert Rodriguez,United States,2005,PG,93 min,Children & Family Movies
TV Show,The Adventures of Sonic the Hedgehog,,"United States, Canada",1993,TV-Y7,1 Season,Kids' TV
Movie,The Adventures of Tintin,Steven Spielberg,"United States, New Zealand, United Kingdom",2011,PG,107 min,Children & Family Movies
Movie,The Aerial,Esteban Sapir,Argentina,2007,TV-MA,99 min,"Dramas, International Movies, Sci-Fi & Fantasy"
Movie,The African Doctor,Julien Rambaldi,France,2016,TV-14,94 min,"Comedies, Dramas, International Movies"
Movie,The After Party,Ian Edelman,United States,2018,TV-MA,90 min,"Comedies, Music & Musicals"
Movie,The Age of Shadows,Jee-woon Kim,South Korea,2016,TV-MA,140 min,"Action & Adventure, Dramas, International Movies"
TV Show,The Alcàsser Murders,Elías León,Spain,2019,TV-MA,1 Season,"Crime TV Shows, Docuseries, International TV Shows"
Movie,The Amazing Praybeyt Benjamin,Wenn V. Deramas,Philippines,2014,TV-14,105 min,"Action & Adventure, Comedies, International Movies"
Movie,The American,Anton Corbijn,"United States, United Kingdom",2010,R,105 min,"Dramas, Thrillers"
TV Show,The American Barbecue Showdown,,United States,2020,TV-G,1 Season,Reality TV
TV Show,The American Bible Challenge,Michael Simon,United States,2014,TV-G,1 Season,Reality TV
Movie,The American Game,Mostafa Abu Seif,,2019,TV-PG,91 min,"Comedies, International Movies, Romantic Movies"
Movie,The American Meme,Bert Marcus,United States,2018,TV-MA,98 min,Documentaries
Movie,The American President,Rob Reiner,United States,1995,PG-13,113 min,"Comedies, Dramas, Romantic Movies"
Movie,The Amityville Horror,Andrew Douglas,United States,2005,R,89 min,Horror Movies
Movie,The Angel,Ariel Vromen,"Israel, United States",2018,TV-MA,114 min,"Dramas, International Movies, Thrillers"
Movie,The Angry Birds Movie 2,"Thurop Van Orman, John Rice","Finland, United States",2019,PG,97 min,"Children & Family Movies, Comedies"
Movie,The Animal People,"Denis Hennelly, Casey Suchan",United States,2019,TV-MA,97 min,Documentaries
Movie,The Ant's Scream,Sameh Abdulaziz,Egypt,2010,TV-14,108 min,"Comedies, Dramas, International Movies"
TV Show,The Apartment,,Singapore,2014,TV-PG,2 Seasons,"International TV Shows, Reality TV"
Movie,The Apostate,Federico Veiroj,"Spain, France, Uruguay",2015,TV-MA,80 min,"Comedies, Dramas, International Movies"
Movie,The App,Elisa Fuksas,Italy,2019,TV-MA,79 min,"Dramas, Independent Movies, International Movies"
Movie,The App That Stole Christmas,Monica Floyd,United States,2020,TV-PG,64 min,"Children & Family Movies, Comedies"
Movie,The Arbitration,Niyi Akinmolayan,Nigeria,2016,TV-MA,101 min,"Dramas, International Movies"
Movie,The Art of Loving,Maria Sadowska,Poland,2017,TV-MA,115 min,"Dramas, International Movies"
Movie,The Art of the Steal,Jonathan Sobol,"Canada, United States",2013,R,90 min,"Action & Adventure, Comedies, Independent Movies"
Movie,The Art of War,Christian Duguay,"United States, Canada",2000,R,117 min,Action & Adventure
Movie,The Artist,Michel Hazanavicius,"France, Belgium, United States",2011,PG-13,101 min,"Comedies, Dramas, Independent Movies"
TV Show,The Assassination of Gianni Versace,,United States,2018,TV-MA,1 Season,"Crime TV Shows, TV Dramas, TV Thrillers"
Movie,The Assignment,Walter Hill,"France, Canada, United States",2016,R,95 min,Action & Adventure
Movie,The Autopsy of Jane Doe,André Øvredal,"United Kingdom, United States",2016,R,86 min,"Horror Movies, Independent Movies, Thrillers"
Movie,The Awakening of Motti Wolkenbruch,Michael Steiner,Switzerland,2018,TV-MA,94 min,"Comedies, Dramas, International Movies"
Movie,The B-Side: Elsa Dorfman's Portrait Photography,Errol Morris,United States,2016,R,76 min,Documentaries
TV Show,The Baby-Sitters Club,,United States,2020,TV-G,1 Season,"Kids' TV, TV Dramas"
Movie,The Babysitter,McG,United States,2017,TV-MA,85 min,"Comedies, Horror Movies"
Movie,The Babysitter: Killer Queen,McG,United States,2020,TV-MA,102 min,"Comedies, Horror Movies"
TV Show,The Bachelor,,,2009,TV-14,1 Season,"Reality TV, Romantic TV Shows"
TV Show,The Bachelorette,,United States,2010,TV-14,1 Season,"Reality TV, Romantic TV Shows"
Movie,The Bachelors,Kurt Voelker,United States,2017,TV-14,100 min,Dramas
Movie,The Bad Batch,Ana Lily Amirpour,United States,2016,R,119 min,"Dramas, Independent Movies, Thrillers"
Movie,The Bad Education Movie,Elliot Hegarty,United Kingdom,2015,TV-MA,87 min,Comedies
Movie,The Bad Kids,"Keith Fulton, Louis Pepe",United States,2016,TV-MA,101 min,Documentaries
TV Show,The Baker and the Beauty,,"Israel, United States",2020,TV-PG,1 Season,"Romantic TV Shows, TV Comedies, TV Dramas"
Movie,The Ballad of Buster Scruggs,"Joel Coen, Ethan Coen",United States,2018,R,133 min,"Comedies, Dramas"
Movie,The Ballad of Lefty Brown,Jared Moshé,United States,2017,R,112 min,Dramas
Movie,The Bank Job,Roger Donaldson,"United Kingdom, United States, Australia",2008,R,112 min,"Dramas, International Movies, Thrillers"
Movie,The Bar,Álex de la Iglesia,"Spain, Argentina",2017,TV-MA,102 min,"Comedies, Horror Movies, International Movies"
