type,title,director,country,release_year,rating,duration,listed_in
TV Show,Eastsiders,,United States,2018,TV-MA,4 Seasons,"TV Comedies, TV Dramas"
TV Show,Easy,,United States,2019,TV-MA,3 Seasons,"TV Comedies, TV Dramas"
Movie,Easy A,Will Gluck,United States,2010,PG-13,92 min,"Comedies, Romantic Movies"
TV Show,Easy Fortune Happy Life,,Taiwan,2009,TV-MA,1 Season,"International TV Shows, Romantic TV Shows, TV Comedies"
Movie,Eat Pray Love,Ryan Murphy,United States,2010,PG-13,140 min,"Dramas, Romantic Movies"
Movie,Echcharikkai,Sarjun,India,2018,TV-14,127 min,"International Movies, Thrillers"
Movie,Echo in the Canyon,Andrew Slater,United States,2019,PG-13,82 min,"Documentaries, Music & Musicals"
Movie,Eddie - Strongman,Matt Bell,United Kingdom,2015,TV-MA,98 min,"Documentaries, Sports Movies"
Movie,Eddie Murphy: Delirious,Bruce Gowers,United States,1983,TV-MA,69 min,Stand-Up Comedy
Movie,Eddie Murphy: Raw,Robert Townsend,United States,1987,R,90 min,Stand-Up Comedy
TV Show,Eden,,,2021,TV-PG,1 Season,"Anime Series, International TV Shows"
TV Show,EDENS ZERO,,Japan,2021,TV-14,1 Season,"Anime Series, International TV Shows"
TV Show,Edgar Rice Burroughs' Tarzan and Jane,,,2018,TV-Y7,2 Seasons,"Crime TV Shows, Kids' TV"
Movie,Edge of Fear,Bobby Roth,United States,2018,TV-MA,92 min,"Independent Movies, Thrillers"
Movie,Edge of Seventeen,David Moreton,United States,1998,TV-MA,103 min,"Comedies, Dramas, Independent Movies"
TV Show,Edge of the Universe,,United Kingdom,2008,TV-G,1 Season,"British TV Shows, Docuseries, Science & Nature TV"
TV Show,Edha,,Argentina,2018,TV-MA,1 Season,"International TV Shows, Spanish-Language TV Shows, TV Dramas"
Movie,"Edmilson Filho: Notas, Comedy about Relationships",Halder Gomes,Brazil,2017,TV-MA,80 min,Stand-Up Comedy
Movie,Edoardo Ferrario: Temi Caldi,Francesco Imperato,Italy,2019,TV-MA,65 min,Stand-Up Comedy
Movie,Ee Nagaraniki Emaindi,Tharun Bhascker,India,2018,TV-14,133 min,"Comedies, Independent Movies, International Movies"
Movie,Eeb Allay Ooo!,Prateek Vats,India,2019,TV-MA,97 min,"Comedies, Dramas, Independent Movies"
Movie,Eeda,Ajithkumar,India,2018,TV-14,153 min,"Dramas, International Movies, Romantic Movies"
Movie,Eerie,Mikhail Red,"Philippines, Singapore",2019,TV-14,100 min,"Horror Movies, International Movies"
Movie,Effie Gray,Richard Laxton,United Kingdom,2014,PG-13,109 min,"Dramas, International Movies, Romantic Movies"
Movie,Ég man þig,Óskar Thór Axelsson,Iceland,2017,TV-MA,106 min,"Horror Movies, International Movies"
Movie,Eggnoid: Love & Time Portal,Naya Anindita,Indonesia,2019,TV-14,102 min,"Dramas, International Movies, Romantic Movies"
Movie,Eh Janam Tumhare Lekhe,Harjit Singh,India,2015,TV-14,124 min,"Dramas, International Movies"
TV Show,Einsatzgruppen: The Nazi Death Squads,,France,2009,TV-MA,1 Season,"Docuseries, International TV Shows"
Movie,Either Me Or My Auntie,Saeed Hamed,Egypt,2006,TV-PG,105 min,"Comedies, International Movies"
Movie,Ek Cup Chya,"Sumitra Bhave, Sunil Sukthankar",India,2009,TV-PG,120 min,"Dramas, Independent Movies, International Movies"
Movie,Ek Hasina Thi,Sriram Raghavan,India,2004,TV-MA,134 min,"Dramas, International Movies, Thrillers"
Movie,Ek Jaan Hain Hum,Rajiv Mehra,India,1983,TV-14,151 min,"Dramas, International Movies, Music & Musicals"
Movie,Ek Khiladi Ek Haseena,Suparn Verma,India,2005,TV-14,141 min,"International Movies, Music & Musicals, Thrillers"
Movie,Ek Ladki Ko Dekha Toh Aisa Laga,Shelly Chopra Dhar,India,2019,TV-14,120 min,"Comedies, Dramas, International Movies"
Movie,Ek Main Aur Ekk Tu,Shakun Batra,India,2012,TV-14,106 min,"Comedies, International Movies, Romantic Movies"
Movie,Ekşi Elmalar,Yılmaz Erdoğan,Turkey,2016,TV-PG,109 min,"Dramas, International Movies"
TV Show,El Barco,,Spain,2013,NR,3 Seasons,"International TV Shows, Romantic TV Shows, Spanish-Language TV Shows"
Movie,El Camino Christmas,David E. Talbert,United States,2017,TV-MA,89 min,"Comedies, Dramas"
Movie,El Camino: A Breaking Bad Movie,Vince Gilligan,United States,2019,TV-MA,123 min,"Dramas, Thrillers"
TV Show,El Cartel,,Colombia,2008,TV-MA,1 Season,"Crime TV Shows, International TV Shows, Spanish-Language TV Shows"
TV Show,El Cartel 2,,Colombia,2010,TV-MA,1 Season,"Crime TV Shows, International TV Shows, Spanish-Language TV Shows"
TV Show,El Chapo,,"Mexico, United States",2018,TV-MA,3 Seasons,"Crime TV Shows, Spanish-Language TV Shows, TV Action & Adventure"
TV Show,El Chavo,,Mexico,1979,TV-PG,1 Season,"Classic & Cult TV, Kids' TV, Spanish-Language TV Shows"
Movie,El Che,Matías Gueilburt,Venezuela,2017,TV-14,119 min,"Documentaries, International Movies"
TV Show,El Chema,,Mexico,2016,TV-MA,1 Season,"Crime TV Shows, Spanish-Language TV Shows, TV Action & Adventure"
TV Show,El Clon,,United States,2010,TV-14,1 Season,"Romantic TV Shows, Spanish-Language TV Shows, TV Dramas"
Movie,El club de los buenos infieles,,Spain,2018,TV-MA,85 min,"Comedies, International Movies"
Movie,El club de los insomnes,"Joseduardo Giordano, Sergio Goyri Jr.",Mexico,2018,TV-MA,82 min,"Dramas, International Movies"
TV Show,El desconocido,,,2019,TV-MA,2 Seasons,"Crime TV Shows, International TV Shows, Spanish-Language TV Shows"
TV Show,El Dragón: Return of a Warrior,,Mexico,2020,TV-MA,2 Seasons,"Crime TV Shows, International TV Shows, Spanish-Language TV Shows"
Movie,"El Especial de Alex Fernández, el Especial",Jan Suter,Mexico,2017,TV-MA,52 min,Stand-Up Comedy
Movie,El fin de ETA,Justin Webster,Spain,2017,TV-14,106 min,"Documentaries, International Movies"
TV Show,El final del paraíso,,"United States, Colombia",2019,TV-MA,1 Season,"Crime TV Shows, International TV Shows, Spanish-Language TV Shows"
Movie,El límite infinito,Pablo Aulita,,2020,TV-PG,48 min,"Documentaries, International Movies, Sports Movies"
TV Show,El Marginal,,Argentina,2019,TV-MA,3 Seasons,"Crime TV Shows, International TV Shows, Spanish-Language TV Shows"
Movie,"El patrón, radiografía de un crimen",Sebastián Schindel,"Argentina, Venezuela",2014,TV-MA,100 min,"Dramas, International Movies, Thrillers"
Movie,"El Pepe, a Supreme Life",Emir Kusturica,"Argentina, Uruguay, Serbia",2018,TV-14,73 min,"Documentaries, International Movies"
Movie,El Potro: Unstoppable,Lorena Munoz,,2018,TV-MA,122 min,"Dramas, International Movies, Music & Musicals"
TV Show,El Reemplazante,,Chile,2013,TV-MA,2 Seasons,"International TV Shows, Spanish-Language TV Shows, TV Dramas"
Movie,El sendero de la anaconda,Alessandro Angulo,Colombia,2019,TV-14,74 min,"Documentaries, International Movies"
TV Show,El señor de los Cielos,,"United States, Mexico, Colombia",2019,TV-MA,7 Seasons,"Crime TV Shows, International TV Shows, Spanish-Language TV Shows"
Movie,El silencio es bienvenido,Gabriela García Rivas,Mexico,2017,TV-14,95 min,"Dramas, Independent Movies, International Movies"
Movie,El testigo,Kate Horne,"Colombia, Peru, United Kingdom",2018,TV-14,73 min,"Documentaries, International Movies"
Movie,El último testigo,Philipp Stölzl,"United States, Canada, Belgium, United Kingdom",2012,R,105 min,Action & Adventure
TV Show,El Vato,,United States,2017,TV-MA,2 Seasons,"International TV Shows, Spanish-Language TV Shows, TV Comedies"
Movie,El Viaje: Márama y Rombai,Federico Lemos,,2016,TV-PG,79 min,"Children & Family Movies, Documentaries, International Movies"
Movie,El-Khawaga's Dilemma,Peter Mimi,Egypt,2018,TV-14,94 min,"Action & Adventure, Comedies, International Movies"
Movie,Elaan,K. Ramanlal,India,1971,TV-14,143 min,"Action & Adventure, Cult Movies, International Movies"
Movie,Elena,Petra Costa,"Brazil, United States",2012,TV-MA,81 min,"Documentaries, International Movies"
Movie,Elephants Dream 4 Hour,Bassam Kurdali,Netherlands,2006,TV-MA,196 min,"International Movies, Sci-Fi & Fantasy"
Movie,Elevator Baby,Akhigbe Ilozobhie,Nigeria,2019,TV-MA,84 min,"Dramas, International Movies"
Movie,Elf Pets: A Fox Cub’s Christmas Tale,Chanda Bell,United States,2020,TV-Y,28 min,Children & Family Movies
Movie,Elf Pets: Santa’s Reindeer Rescue,Chanda Bell,United States,2020,TV-Y,27 min,Children & Family Movies
Movie,Eli,Ciarán Foy,United States,2019,TV-MA,98 min,Horror Movies
Movie,Elisa & Marcela,Isabel Coixet,Spain,2019,TV-MA,119 min,"Dramas, International Movies, LGBTQ Movies"
TV Show,Elite,,Spain,2021,TV-MA,4 Seasons,"Crime TV Shows, International TV Shows, Spanish-Language TV Shows"
TV Show,Elite Short Stories: Carla Samuel,,,2021,TV-MA,1 Season,"International TV Shows, Romantic TV Shows, Spanish-Language TV Shows"
TV Show,Elite Short Stories: Guzmán Caye Rebe,,,2021,TV-MA,1 Season,"International TV Shows, Spanish-Language TV Shows, TV Dramas"
TV Show,Elite Short Stories: Nadia Guzmán,,,2021,TV-MA,1 Season,"International TV Shows, Romantic TV Shows, Spanish-Language TV Shows"
TV Show,Elite Short Stories: Omar Ander Alexis,,,2021,TV-MA,1 Season,"International TV Shows, Spanish-Language TV Shows, TV Dramas"
Movie,Elizabeth and Margaret: Love and Loyalty,,United Kingdom,2020,TV-PG,87 min,Documentaries
Movie,Elizabeth at 90: A Family Tribute,John Bridcut,United Kingdom,2016,TV-G,90 min,Documentaries
Movie,Elizabeth Harvest,Sebastian Gutierrez,United States,2019,R,109 min,"Dramas, Sci-Fi & Fantasy"
TV Show,Elize Matsunaga: Once Upon a Crime,,,2021,TV-MA,1 Season,"Crime TV Shows, Docuseries, International TV Shows"
TV Show,Ellen DeGeneres: Relatable,"Joel Gallen, Tig Notaro",United States,2018,TV-MA,1 Season,"Stand-Up Comedy & Talk Shows, TV Comedies"
Movie,Elles étaient en guerre (1914-1918),"Fabien Beziat, Hugues Nancy",France,2014,TV-14,93 min,"Documentaries, International Movies"
Movie,Elles étaient en guerre 1939-1945,"Hugues Nancy, Fabien Beziat",,2015,TV-MA,92 min,"Documentaries, International Movies"
Movie,Elles ont toutes une histoire,Nils Tavernier,,2016,TV-PG,49 min,"Documentaries, International Movies"
Movie,Elliot the Littlest Reindeer,Jennifer Westcott,Canada,2018,PG,90 min,Children & Family Movies
Movie,Elstree 1976,Jon Spira,United Kingdom,2015,TV-PG,102 min,Documentaries
Movie,Emelie,Michael Thelin,United States,2016,TV-MA,82 min,"Horror Movies, Thrillers"
Movie,EMI: Liya Hai To Chukana Padega,Saurabh Kabra,India,2008,TV-14,128 min,"Comedies, Dramas, International Movies"
Movie,Emicida: AmarElo - It’s All For Yesterday,,Brazil,2020,TV-MA,90 min,"Documentaries, International Movies, Music & Musicals"
Movie,Emicida: AmarElo - Live in São Paulo,Fred Ouro Preto,,2021,TV-MA,100 min,"Documentaries, International Movies, Music & Musicals"
TV Show,Emily in Paris,,United States,2020,TV-MA,1 Season,"Romantic TV Shows, TV Comedies, TV Dramas"
TV Show,Emily's Wonder Lab,,United States,2020,TV-Y,1 Season,Kids' TV
Movie,Emma' (Mother),Riri Riza,Indonesia,2016,TV-PG,74 min,"Dramas, International Movies"
Movie,Emo the Musical,Neil Triffett,Australia,2016,TV-MA,94 min,"Dramas, International Movies, Music & Musicals"
TV Show,Emogenius,,United States,2017,TV-PG,1 Season,Reality TV
TV Show,Empire Games,,"Czech Republic, United States",2018,TV-14,1 Season,Docuseries
Movie,Empire of Scents,Kim Nguyen,"Canada, France, Italy, Morocco, United States",2014,TV-14,87 min,"Documentaries, International Movies"
Movie,Employee of the Month,Greg Coolidge,United States,2006,PG-13,108 min,"Comedies, Romantic Movies"
TV Show,Encerrados,,,2018,TV-MA,1 Season,"International TV Shows, Spanish-Language TV Shows, TV Comedies"
Movie,Encounter: The Killing,Ajay Phansekar,India,2002,TV-14,151 min,"Dramas, Independent Movies, International Movies"
TV Show,Encounters with Evil,,United Kingdom,2016,TV-14,1 Season,"British TV Shows, Crime TV Shows, Docuseries"
Movie,End Game,"Rob Epstein, Jeffrey Friedman",United States,2018,TV-PG,40 min,Documentaries
Movie,End of Watch,David Ayer,United States,2012,R,109 min,Action & Adventure
TV Show,Enemigo íntimo,,,2018,TV-MA,1 Season,"Crime TV Shows, Spanish-Language TV Shows, TV Dramas"
Movie,Enemy,Denis Villeneuve,"Canada, Spain, France",2013,R,91 min,"Independent Movies, Thrillers"
TV Show,Engineering Girls,,India,2018,TV-MA,1 Season,"International TV Shows, TV Comedies"
Movie,English Babu Desi Mem,Praveen Nischol,India,1996,TV-14,163 min,"Comedies, Dramas, International Movies"
Movie,Enissa Amani: Ehrenwort,Max Amini,Germany,2018,TV-MA,66 min,Stand-Up Comedy
Movie,Enlighten Us,Jenny Carchman,United States,2016,TV-14,93 min,Documentaries
Movie,Enola Holmes,Harry Bradbeer,United Kingdom,2020,PG-13,124 min,"Action & Adventure, Children & Family Movies, Dramas"
TV Show,Entangled,,South Korea,2014,TV-14,1 Season,"International TV Shows, TV Dramas"
Movie,Entanglement,Jason James,Canada,2018,TV-MA,85 min,"Dramas, Independent Movies, Romantic Movies"
Movie,Enter the Anime,Alex Burunova,"United States, Japan",2019,TV-MA,59 min,"Documentaries, International Movies"
Movie,Enter the Dragon,Robert Clouse,"Hong Kong, United States",1973,R,103 min,"Action & Adventure, Classic Movies"
Movie,Enter the Warriors Gate,Matthias Hoene,"France, Canada, China, Cambodia",2016,PG-13,105 min,"Action & Adventure, International Movies, Sci-Fi & Fantasy"
TV Show,Episodes,,"United Kingdom, United States",2017,TV-MA,5 Seasons,"Classic & Cult TV, TV Comedies"
Movie,Equals,Drake Doremus,"United States, Indonesia",2015,PG-13,102 min,"Dramas, Romantic Movies, Sci-Fi & Fantasy"
TV Show,Equestria Girls: Tales of Canterlot High,,"United States, Canada",2017,TV-Y7,1 Season,"Kids' TV, TV Comedies"
Movie,Equilibrium,Kurt Wimmer,United States,2002,R,107 min,"Action & Adventure, Dramas, Sci-Fi & Fantasy"
TV Show,Equinox,,"Denmark, United States",2020,TV-MA,1 Season,"International TV Shows, TV Mysteries, TV Thrillers"
TV Show,Erased,,Japan,2016,TV-14,1 Season,"Anime Series, International TV Shows, TV Thrillers"
Movie,Eric Andre: Legalize Everything,Eric Notarnicola,United States,2020,TV-MA,52 min,Stand-Up Comedy
Movie,Eric ldle's What About Dick?,"Eric Idle, Aubrey Powell",United States,2012,TV-MA,81 min,"Comedies, Music & Musicals"
Movie,Errementari: The Blacksmith and the Devil,Paul Urkijo Alijo,"Spain, France",2018,TV-MA,99 min,"Horror Movies, International Movies, Sci-Fi & Fantasy"
Movie,Escape from Mr. Lemoncello’s Library,Scott McAboy,United States,2017,TV-Y,69 min,Children & Family Movies
Movie,Escape from Planet Earth,Cal Brunker,"United States, Canada",2013,PG,89 min,"Children & Family Movies, Comedies, Sci-Fi & Fantasy"
Movie,"Escape from the ""Liberty"" Cinema",Wojciech Marczewski,Poland,1990,TV-MA,88 min,"Comedies, Dramas, Independent Movies"
Movie,Escaping Tel Aviv,Sherif Arafa,Egypt,2009,TV-14,120 min,"Action & Adventure, International Movies"
TV Show,Especial 20 años Fútbol de Primera,,,2020,TV-14,1 Season,"Docuseries, International TV Shows, Spanish-Language TV Shows"
Movie,Esperando la carroza,Alejandro Doria,Argentina,1985,TV-MA,95 min,"Comedies, Cult Movies, International Movies"
Movie,Esperando La Carroza,Alejandro Doria,Argentina,1985,NR,95 min,"Comedies, Cult Movies, International Movies"
Movie,Estar o no estar,Marcelo González,Mexico,2016,TV-14,100 min,"Dramas, International Movies, Romantic Movies"
TV Show,Eternal Love,,China,2017,TV-14,1 Season,"International TV Shows, Romantic TV Shows, TV Dramas"
Movie,Ethirmarai,,India,2018,TV-14,91 min,"International Movies, Music & Musicals, Thrillers"
TV Show,Ethos,,Turkey,2020,TV-MA,1 Season,"International TV Shows, TV Dramas"
TV Show,Eugenie Nights,,Egypt,2018,TV-14,1 Season,"International TV Shows, Romantic TV Shows, TV Dramas"
Movie,Euphoria,Valeria Golino,Italy,2018,R,110 min,"Dramas, International Movies, LGBTQ Movies"
Movie,Europe's Most Dangerous Man: Otto Skorzeny in Spain,"Pedro de Echave García, Pablo Azorín Williams",,2020,TV-MA,67 min,"Documentaries, International Movies"
TV Show,Eurovision Song Contest,,,2019,TV-PG,1 Season,International TV Shows
Movie,Eurovision Song Contest: The Story of Fire Saga,David Dobkin,United States,2020,PG-13,124 min,"Comedies, Music & Musicals, Romantic Movies"
Movie,Evan Almighty,Tom Shadyac,United States,2007,PG,96 min,"Children & Family Movies, Comedies, Faith & Spirituality"
Movie,EVANGELION: DEATH (TRUE)²,Hideaki Anno,Japan,1998,TV-MA,69 min,"Action & Adventure, Anime Features, International Movies"
Movie,Eve's Apple,Jose Manuel Colón,Spain,2017,TV-MA,91 min,"Documentaries, International Movies"
Movie,Evelyn,Orlando von Einsiedel,United Kingdom,2019,TV-MA,96 min,"Documentaries, International Movies"
Movie,Even the Rain,Icíar Bollaín,"Spain, Mexico, France",2010,TV-MA,103 min,"Dramas, International Movies"
Movie,Evening Shadows,Sridhar Rangayan,India,2018,TV-PG,102 min,"Dramas, Independent Movies, International Movies"
Movie,Event Horizon,Paul W.S. Anderson,"United Kingdom, United States",1997,R,96 min,"Horror Movies, Sci-Fi & Fantasy"
TV Show,Ever After High,,Canada,2016,TV-Y7,5 Seasons,Kids' TV
Movie,Every Time I Die,Robi Michael,United States,2019,TV-MA,98 min,"Dramas, Independent Movies, Thrillers"
Movie,Everybody Knows,Asghar Farhadi,"Spain, France, Italy",2019,R,133 min,"Dramas, International Movies, Thrillers"
Movie,Everyday I Love You,Mae Czarina Cruz,Philippines,2015,TV-14,124 min,"Dramas, International Movies, Romantic Movies"
TV Show,Everyday Miracles,,United Kingdom,2014,TV-PG,1 Season,"British TV Shows, Docuseries, International TV Shows"
Movie,Everything About Her,Joyce Bernal,Philippines,2016,TV-MA,127 min,"Comedies, Dramas, International Movies"
TV Show,Everything Sucks!,,United States,2018,TV-14,1 Season,"TV Comedies, TV Dramas, Teen TV Shows"
TV Show,Everything Will Be Fine,,,2021,TV-MA,1 Season,"International TV Shows, Spanish-Language TV Shows, TV Comedies"
TV Show,Evil,,United States,2019,TV-14,1 Season,TV Dramas
TV Show,Evil Genius,"Trey Borzillieri, Barbara Schroeder",United States,2018,TV-MA,1 Season,"Crime TV Shows, Docuseries, TV Mysteries"
Movie,Evolution,Ivan Reitman,United States,2001,PG-13,102 min,"Comedies, Sci-Fi & Fantasy"
Movie,Evvarikee Cheppoddu,Basava Shankar Eeday,India,2019,TV-14,134 min,"Comedies, International Movies, Romantic Movies"
Movie,Ex Machina,Alex Garland,United Kingdom,2015,R,108 min,"Dramas, Independent Movies, International Movies"
TV Show,Ex-Boyfriend,,China,2011,TV-14,1 Season,"International TV Shows, Romantic TV Shows, TV Comedies"
TV Show,Examination of Conscience,,Spain,2019,TV-MA,1 Season,"Crime TV Shows, Docuseries, International TV Shows"
TV Show,Exclusive Edition,James Lee,,2008,TV-14,1 Season,"International TV Shows, TV Dramas"
Movie,Executive Decision,Stuart Baird,United States,1996,R,133 min,Action & Adventure
Movie,Exes Baggage,Dan Villegas,Philippines,2018,TV-MA,103 min,"Dramas, International Movies, Romantic Movies"
TV Show,Exhibit A,,United States,2019,TV-MA,1 Season,"Crime TV Shows, Docuseries, Science & Nature TV"
Movie,Exit Afghanistan,"Anders Sømme Hammer, Marius Arnesen, Klaus Erik Okstad, Olav Njaastad",Norway,2013,TV-MA,58 min,"Documentaries, International Movies"
Movie,Exit Strategy,Michael Whitton,United States,2012,NR,79 min,"Comedies, Romantic Movies"
Movie,Exit Wounds,Andrzej Bartkowiak,United States,2001,R,101 min,Action & Adventure
Movie,Expedition China,Ben Wallis,,2017,TV-G,78 min,"Children & Family Movies, Documentaries"
Movie,Expedition Happiness,Selima Taibi,Germany,2017,TV-PG,96 min,"Documentaries, International Movies"
Movie,Expelled from Paradise,Seiji Mizushima,Japan,2014,TV-MA,103 min,"Action & Adventure, Anime Features, Sci-Fi & Fantasy"
TV Show,Explained,,United States,2021,TV-MA,3 Seasons,"Docuseries, Science & Nature TV"
Movie,Expo,Joseph Mbah,United States,2019,TV-14,81 min,"Action & Adventure, Dramas, Independent Movies"
Movie,Extinction,Ben Young,United States,2018,TV-MA,95 min,"Action & Adventure, Dramas, Sci-Fi & Fantasy"
Movie,Extraction,Steven C. Miller,"United States, United Kingdom, Canada",2015,R,82 min,Action & Adventure
TV Show,Extracurricular,,South Korea,2020,TV-MA,1 Season,"Crime TV Shows, International TV Shows, Korean TV Shows"
TV Show,Extras,,"United Kingdom, United States",2006,TV-MA,2 Seasons,"British TV Shows, TV Comedies"
TV Show,Extreme Engagement,,,2019,TV-MA,1 Season,"International TV Shows, Reality TV"
Movie,"Extremely Wicked, Shockingly Evil and Vile",Joe Berlinger,United States,2019,R,110 min,"Dramas, Independent Movies"
Movie,Extremis,Dan Krauss,United States,2016,TV-PG,25 min,Documentaries
Movie,Eye For An Eye,Paco Plaza,"Spain, France, United States",2019,TV-MA,108 min,"Dramas, International Movies, Thrillers"
Movie,Eyyvah Eyyvah,Hakan Algül,Turkey,2010,TV-MA,99 min,"Comedies, International Movies"
Movie,Eyyvah Eyyvah 2,Hakan Algül,Turkey,2011,TV-PG,106 min,"Comedies, International Movies, Romantic Movies"
Movie,Eyyvah Eyyvah 3,Hakan Algül,Turkey,2014,TV-PG,103 min,"Comedies, International Movies"
TV Show,Ezel,,Turkey,2009,TV-14,1 Season,"Crime TV Shows, International TV Shows, TV Dramas"
TV Show,F is for Family,,"United States, France, Canada",2020,TV-MA,4 Seasons,TV Comedies
Movie,F the Prom,Benny Fine,United States,2017,TV-MA,92 min,"Comedies, Romantic Movies"
Movie,F.R.E.D.I.,Sean Olson,United States,2018,TV-PG,90 min,"Children & Family Movies, Sci-Fi & Fantasy"
Movie,Fabrizio Copano: Solo pienso en mi,"Rodrigo Toro, Francisco Schultz",Chile,2017,TV-MA,60 min,Stand-Up Comedy
TV Show,Fabulous Lives of Bollywood Wives,,India,2020,TV-MA,1 Season,"International TV Shows, Reality TV"
Movie,Face 2 Face,Matt Toronto,United States,2017,TV-MA,89 min,"Dramas, Independent Movies"
Movie,Fadily Camara : La plus drôle de tes copines,Gautier & Leduc,France,2019,TV-MA,54 min,Stand-Up Comedy
TV Show,Fairy Tail,,Japan,2009,TV-MA,1 Season,"Anime Series, International TV Shows"
Movie,"Faith, Hope & Love",Robert Krantz,United States,2019,PG,106 min,"Comedies, Faith & Spirituality, Romantic Movies"
TV Show,Fake or Fortune?,,United Kingdom,2015,TV-G,1 Season,"British TV Shows, Crime TV Shows, Docuseries"
Movie,Fakkah Fuzz: Almost Banned,Michael McKay,Singapore,2018,TV-MA,61 min,Stand-Up Comedy
Movie,Fakta Ladh Mhana,Sanjay Jadhav,India,2011,TV-14,150 min,"Action & Adventure, Dramas, International Movies"
Movie,Fall Girls,Chris Stokes,United States,2019,TV-14,80 min,Comedies
TV Show,Fall in Love with Me,,Taiwan,2014,TV-14,1 Season,"International TV Shows, Romantic TV Shows, TV Comedies"
Movie,Fallen,Gregory Hoblit,United States,1998,R,124 min,Thrillers
TV Show,Fallet,,Sweden,2017,TV-MA,1 Season,"Crime TV Shows, International TV Shows, TV Comedies"
Movie,Falling Inn Love,Roger Kumble,United States,2019,TV-PG,98 min,"Comedies, Romantic Movies"
TV Show,Falsa identidad,,Mexico,2020,TV-MA,2 Seasons,"Crime TV Shows, Spanish-Language TV Shows, TV Dramas"
Movie,Falz Experience,Falz,,2018,TV-MA,82 min,"International Movies, Music & Musicals"
TV Show,Familiar Wife,,South Korea,2018,TV-MA,1 Season,"International TV Shows, Romantic TV Shows, TV Dramas"
Movie,Familiye,"Sedat Kirtan, Kubilay Sarikaya",Germany,2017,TV-MA,99 min,"Dramas, Independent Movies, International Movies"
Movie,Family Blood,Sonny Mallhi,United States,2018,TV-MA,92 min,Horror Movies
TV Show,Family Business,,France,2020,TV-MA,2 Seasons,"International TV Shows, TV Comedies, TV Dramas"
TV Show,Family Reunion,,United States,2021,TV-PG,4 Seasons,"Kids' TV, TV Comedies"
Movie,Famous in Ahmedabad,Hardik Mehta,India,2015,TV-14,29 min,"Documentaries, International Movies"
Movie,Fan Girl,Antoinette Jadaone,Philippines,2020,TV-MA,101 min,"Dramas, Independent Movies, International Movies"
Movie,Fan of Amoory,Salmeen AlMurry Amer,United Arab Emirates,2018,TV-G,109 min,"Children & Family Movies, Dramas, International Movies"
Movie,Fanatic,Keith L. Smith,United States,2019,TV-14,91 min,Thrillers
Movie,Fanatyk,Michał Tylka,Poland,2017,TV-MA,33 min,"Comedies, Dramas, Independent Movies"
Movie,Fandry,Nagraj Manjule,India,2014,NR,102 min,"Dramas, Independent Movies, International Movies"
TV Show,Fangbone,,Canada,2016,TV-Y7,1 Season,"Kids' TV, TV Comedies"
Movie,Fantastic Fungi,Louie Schwartzberg,United States,2019,TV-14,81 min,Documentaries
Movie,Fantastica,Barry Gonzalez,Philippines,2018,TV-PG,114 min,"Comedies, International Movies, LGBTQ Movies"
Movie,Faraar,Baljit Singh Deo,Australia,2015,TV-14,146 min,"Action & Adventure, Dramas, International Movies"
Movie,Farce,Shadi Ali,Egypt,2017,TV-MA,94 min,"Comedies, International Movies"
TV Show,Fartsa,,Russia,2015,TV-14,1 Season,"Crime TV Shows, International TV Shows, TV Dramas"
TV Show,Fary : Hexagone,"Adrien Lagier, Ousmane Ly",France,2020,TV-MA,2 Seasons,"International TV Shows, Stand-Up Comedy & Talk Shows, TV Comedies"
Movie,Fary Is the New Black,Kader Aoun,France,2018,TV-MA,75 min,Stand-Up Comedy
Movie,Fashion,Madhur Bhandarkar,India,2008,TV-MA,158 min,"Dramas, International Movies"
TV Show,Fast & Furious Spy Racers,,United States,2021,TV-Y7,5 Seasons,Kids' TV
TV Show,Fastest Car,,United States,2019,TV-MA,2 Seasons,Reality TV
Movie,Fat Ballerina - David A. Arnold,Milton Horowitz,United States,2020,TV-MA,61 min,Stand-Up Comedy
Movie,Fatal Affair,Peter Sullivan,United States,2020,TV-14,90 min,Thrillers
TV Show,Fatal Destiny,,,2016,TV-MA,1 Season,"Crime TV Shows, International TV Shows, TV Action & Adventure"
Movie,Fate of Alakada,Kayode Kasum,Nigeria,2020,TV-14,113 min,"Comedies, International Movies"
TV Show,Fate: The Winx Saga,,"Italy, United Kingdom",2021,TV-MA,1 Season,"British TV Shows, International TV Shows, TV Dramas"
Movie,Fate: The Winx Saga - The Afterparty,,United Kingdom,2021,TV-14,36 min,"Comedies, Dramas"
TV Show,Fate/Apocrypha,,Japan,2017,TV-MA,2 Seasons,"Anime Series, International TV Shows"
TV Show,Fate/EXTRA Last Encore,,Japan,2018,TV-MA,2 Seasons,"Anime Series, International TV Shows"
Movie,Fate/Grand Order -First Order-,Hitoshi Namba,Japan,2016,TV-14,72 min,"Action & Adventure, Anime Features, International Movies"
TV Show,Fate/stay night: Unlimited Blade Works,,Japan,2015,TV-14,2 Seasons,"Anime Series, International TV Shows"
TV Show,Fate/Zero,,Japan,2012,TV-MA,2 Seasons,"Anime Series, International TV Shows"
TV Show,Father Brown,Ian Barber,United Kingdom,2017,TV-14,6 Seasons,"British TV Shows, Crime TV Shows, TV Dramas"
Movie,Father of the Year,,United States,2018,TV-MA,95 min,Comedies
